{"schema_version":"cio-decision-draft/2.1.0","run_id":"rreh-hardening-ablation-insufficient-full-council-v5-20260908","invocation_id":"inv_7cee76d58d10fee5982c6ca6","status":"INSUFFICIENT_EVIDENCE","agent":"runtime_cio","consumed_reports":[{"agent":"runtime_company_analyst","output_hash":"3ee1a8ba59212d3083ae9a0a540c3517aa2faad43c383c8ee30f89ce10ef3bb7"},{"agent":"runtime_skeptic","output_hash":"dd0ce1eb6b13465e679cd51a65fa77cd432750eb63cf7273ed5f395509dfdef8"}],"action":"NO_TRADE","security_id":"SEC-AAA","current_weight":0.5,"target_weight_range":null,"maximum_notional":null,"time_horizon":"截至下一次获得可核验且在决策截止日前有效的补充证据。","thesis":"Gate 证据仅证实 SEC-AAA 在单一时点的收盘价为 100 USD/股，不能支持公司质量、估值、催化剂、流动性或风险回报判断。","counter_thesis":"独立 Skeptic 指出，将单一收盘价视为持仓合理性的充分依据依赖未验证假设；缺乏价格背景、波动性与下行路径证据。","consensus":["两份已验证报告均认定唯一授权的单一价格证据不足以评估该持仓。","已通过 runtime_cio 对 ev-insufficient-price 的 Gate-scoped 查询核验唯一事实。"],"conflicts":[],"unresolved_questions":["SEC-AAA 的基本面、财务表现和竞争地位为何？","其估值、流动性、历史价格、风险暴露及相关事件证据为何？"],"invalidation_conditions":["若唯一收盘价的来源、截至时间或检索时间被更正或发生冲突，应重新核验该事实。","若获得符合 Gate 与 decision_cutoff 要求的补充证据，当前证据不足结论应重新评估。"],"confidence":0.05,"confidence_rationale":"对唯一授权收盘价事实可作有限核验，但两份 Specialist 的已验证报告一致指出关键基本面、估值、流动性与风险证据缺失，不能形成持仓判断。","evidence_refs":["ev-insufficient-price"],"no_trade_reason":"INSUFFICIENT_EVIDENCE","no_trade_explanation":"唯一允许证据是一个新鲜的单一收盘价；它不足以支持或反驳持仓的投资依据，因此本 EVAL_ABLATION 运行只能形成 NO_TRADE。","reevaluation_conditions":["在 Gate 授权且不晚于 decision_cutoff 的公司基本面、估值、流动性、历史价格与风险事件证据可核验后重新评估。"],"skill_execution":[{"skill_name":"portfolio-council","version":"3.0.0","invocation_hash":"4af5c3ed9c6805b7b4edd19484b5e65206c542113819771af9198c644e436501"}],"advisory_only":true}
