{"schema_version":"cio-decision-draft/2.1.0","run_id":"rreh-ablation-v2-normal-full-council-20260907","invocation_id":"inv_bc6bf19e70fb53de3ea0734e","status":"INSUFFICIENT_EVIDENCE","agent":"runtime_cio","consumed_reports":[{"agent":"runtime_company_analyst","output_hash":"3cb683eaa94ed63c7d6d831cecf6d3e80334369d35411649b5f8416bb57520fe"},{"agent":"runtime_skeptic","output_hash":"25e280d820fe079dabb06e5dff40192e4d72d8d4e3949a3e47245667932880b7"}],"action":"NO_TRADE","security_id":"SEC-AAA","current_weight":0.5,"target_weight_range":null,"maximum_notional":null,"time_horizon":"在取得并核验新的授权证据前","thesis":"两份经验证 Specialist 报告均未形成任何证据约束的投资主张；当前无法形成可支持动作的 Thesis。","counter_thesis":"独立 Skeptic 同样未获得可验证的授权证据，无法对任何潜在 Thesis 形成可证伪的替代解释。","consensus":["Company Analyst 与 Independent Skeptic 均因授权证据查询传输不可用而返回 INSUFFICIENT_EVIDENCE。","两份报告均未引用任何证据，且置信度为 0。"],"conflicts":[],"unresolved_questions":["授权的 Gate-scoped 证据内容、来源与 point-in-time 时间属性何时可取得并核验？","在证据可用后，SEC-AAA 的商业质量、财务趋势、估值和反证分别如何？"],"invalidation_conditions":["在取得并核验授权证据前，任何关于 SEC-AAA 的商业、估值或行动解释均不成立。"],"confidence":0,"confidence_rationale":"仅可使用两份已验证的 INSUFFICIENT_EVIDENCE 报告，且 CIO 输入没有可用 Evidence References；任何实质性判断都会超出 Gate-scoped Evidence 边界。","evidence_refs":[],"no_trade_reason":"INSUFFICIENT_EVIDENCE","no_trade_explanation":"两名独立 Specialist 均未能取得可验证的授权证据，CIO 输入亦无可用 Evidence References，故不能形成证据约束的组合动作。","reevaluation_conditions":["恢复并成功返回授权的 fixture_evidence.query 结果后，重新执行完整 full-council 评估。","确认每项拟使用证据均属于本运行 Gate 允许集合，并携带可核验 source_id、as_of 与 retrieved_at 后重新评估。"],"skill_execution":[{"skill_name":"portfolio-council","version":"3.0.0","invocation_hash":"6c5e958db282a84bb0e80514d9b54a67ba605ef8759d020cab1f87be85d5f534"}],"advisory_only":true}
