{"schema_version":"cio-decision-draft/2.1.0","run_id":"rreh-ablation-v3-normal-full-council-20260907","invocation_id":"inv_21b07cc7284a4f68f1a6a105","status":"INSUFFICIENT_EVIDENCE","agent":"runtime_cio","consumed_reports":[{"agent":"runtime_company_analyst","output_hash":"8275f7e71b78e878d31bc490aa9039cf5f46fe45cea81fa1cf124a35c0de145f"},{"agent":"runtime_skeptic","output_hash":"638fa82ab292ef984600b74912bc59d3b711cda07bc006b42d9e28da402cbabb"}],"action":"NO_TRADE","security_id":"SEC-AAA","current_weight":0.5,"target_weight_range":null,"maximum_notional":null,"time_horizon":"在取得重估条件所列的可核验证据之前","thesis":"Gate 允许证据显示截至2025-12-31的TTM收入为1,000,000 USD、经营利润率为18%及总债务为150,000 USD，并显示管理层于2026-01-20维持既有产能计划；这些事实不足以验证商业质量、债务服务能力、需求兑现或估值安全边际。","counter_thesis":"独立反证指出，债务、历史利润率、维持产能计划与单一收盘价均不能分别或合并证明偿债能力、利润质量、需求支持或估值吸引力；缺失的现金流、债务结构、订单与资本结构资料对结论具实质性影响。","consensus":["两份已验证报告均确认授权证据覆盖收入、经营利润率、总债务、近期价格和管理层更新，但均识别出现金流、债务结构、增长与估值输入的重大缺口。","两份报告均认为维持产能计划不等于需求、执行或资本回报已获验证。","Gate-scoped CIO 查询确认所有五项证据均为截止日前且标记为FRESH，但未填补专业报告列出的实质性缺口。"],"conflicts":[],"unresolved_questions":["截至决策日的现金、净债务、利息费用、债务期限、契约及自由现金流为何？","利润率的历史序列、一次性项目、客户/产品结构、竞争及定价韧性为何？","产能计划的订单、利用率、资本开支、资金来源、执行里程碑与资本回报为何？","稀释后股数、企业价值、净债务、盈利与现金流估值基础及压力情景为何？"],"invalidation_conditions":["取得显示充足流动性、债务可覆盖且无近期契约压力的截至决策日证据。","取得跨期、经常性且在压力情景下仍具韧性的利润率与现金流证据。","取得可验证的订单、利用率和资本回报数据，显示产能计划由需求支持且执行按计划推进。","取得完整资本结构与估值数据，显示在合理压力情景下仍存在明确安全边际。"],"confidence":0.35,"confidence_rationale":"五项 Gate 允许事实均经截至决策日的只读核验，且两份结构化报告均通过验证；但二者一致指出评估债务服务、利润质量、需求兑现及估值所需的关键资料缺失。没有机械证据冲突，但缺口本身阻止形成具备可验证基础的方向性行动。","evidence_refs":["ev-normal-debt","ev-normal-margin","ev-normal-price","ev-normal-revenue","ev-normal-update"],"no_trade_reason":"INSUFFICIENT_EVIDENCE","no_trade_explanation":"可用事实不足以验证偿债能力、利润与需求的可持续性以及估值安全边际；在这些关键问题未获可核验解决前，本 EVAL_ABLATION 运行不形成方向性行动。","reevaluation_conditions":["获得截至决策日的现金、净债务、利息费用、债务期限、契约及自由现金流资料。","获得利润率历史序列、一次性项目、客户/产品结构、竞争与定价资料。","获得订单、产能利用率、资本开支、资金来源、执行里程碑及资本回报资料。","获得稀释后股数、企业价值、净债务、盈利/现金流估值资料和压力情景分析。"],"skill_execution":[{"skill_name":"portfolio-council","version":"3.0.0","invocation_hash":"a6719eb91fc9ff70b9e31900d964035646b28b678be513df8cd2d2cbb168b6b4"}],"advisory_only":true}
